{
  "$schema": "https://json-schema.org/draft/2020-12/schema",
  "type": "object",
  "properties": {
    "schemaVersion": {
      "$ref": "#/$defs/__schema0"
    },
    "id": {
      "$ref": "#/$defs/__schema1"
    },
    "scopeType": {
      "$ref": "#/$defs/__schema2"
    },
    "scopeId": {
      "$ref": "#/$defs/__schema3"
    },
    "releaseVersion": {
      "$ref": "#/$defs/__schema4"
    },
    "subjectDigest": {
      "$ref": "#/$defs/__schema5"
    },
    "inventoryPath": {
      "$ref": "#/$defs/__schema6"
    },
    "inventoryDigest": {
      "$ref": "#/$defs/__schema5"
    },
    "reviewPolicy": {
      "$ref": "#/$defs/__schema7"
    },
    "reviewMode": {
      "$ref": "#/$defs/__schema8"
    },
    "applicableChecks": {
      "$ref": "#/$defs/__schema12"
    },
    "applicableCheckCount": {
      "$ref": "#/$defs/__schema16"
    },
    "passedApplicableCheckCount": {
      "$ref": "#/$defs/__schema17"
    },
    "reviewerExecutedCheckSetDigest": {
      "$ref": "#/$defs/__schema5"
    },
    "authors": {
      "$ref": "#/$defs/__schema18"
    },
    "reviewer": {
      "$ref": "#/$defs/__schema20"
    },
    "reviewItems": {
      "$ref": "#/$defs/__schema21"
    },
    "inventoryItemCount": {
      "$ref": "#/$defs/__schema30"
    },
    "reviewedItemCount": {
      "$ref": "#/$defs/__schema31"
    },
    "approvedItemCount": {
      "$ref": "#/$defs/__schema32"
    },
    "changesRequestedItemCount": {
      "$ref": "#/$defs/__schema33"
    },
    "unreviewedItemCount": {
      "$ref": "#/$defs/__schema34"
    },
    "outcomeCoverageReview": {
      "$ref": "#/$defs/__schema35"
    },
    "outcomeCoverageConfirmed": {
      "$ref": "#/$defs/__schema41"
    },
    "aggregatePassed": {
      "$ref": "#/$defs/__schema42"
    },
    "generatedAt": {
      "$ref": "#/$defs/__schema14"
    },
    "evidenceDigest": {
      "$ref": "#/$defs/__schema5"
    }
  },
  "required": [
    "schemaVersion",
    "id",
    "scopeType",
    "scopeId",
    "releaseVersion",
    "subjectDigest",
    "inventoryPath",
    "inventoryDigest",
    "reviewPolicy",
    "reviewMode",
    "applicableChecks",
    "applicableCheckCount",
    "passedApplicableCheckCount",
    "reviewerExecutedCheckSetDigest",
    "authors",
    "reviewer",
    "reviewItems",
    "inventoryItemCount",
    "reviewedItemCount",
    "approvedItemCount",
    "changesRequestedItemCount",
    "unreviewedItemCount",
    "outcomeCoverageReview",
    "outcomeCoverageConfirmed",
    "aggregatePassed",
    "generatedAt",
    "evidenceDigest"
  ],
  "additionalProperties": false,
  "allOf": [
    {
      "oneOf": [
        {
          "properties": {
            "reviewPolicy": {
              "properties": {
                "requiredMode": {
                  "const": "self"
                }
              },
              "required": [
                "requiredMode"
              ]
            },
            "reviewMode": {
              "const": "self"
            }
          },
          "required": [
            "reviewPolicy",
            "reviewMode"
          ]
        },
        {
          "properties": {
            "reviewPolicy": {
              "properties": {
                "requiredMode": {
                  "const": "third_party"
                }
              },
              "required": [
                "requiredMode"
              ]
            },
            "reviewMode": {
              "const": "third_party"
            }
          },
          "required": [
            "reviewPolicy",
            "reviewMode"
          ]
        }
      ]
    },
    {
      "if": {
        "properties": {
          "aggregatePassed": {
            "const": true
          }
        },
        "required": [
          "aggregatePassed"
        ]
      },
      "then": {
        "properties": {
          "outcomeCoverageConfirmed": {
            "const": true
          },
          "changesRequestedItemCount": {
            "const": 0
          },
          "unreviewedItemCount": {
            "const": 0
          },
          "applicableChecks": {
            "items": {
              "properties": {
                "exitCode": {
                  "const": 0
                },
                "passed": {
                  "const": true
                }
              }
            }
          },
          "reviewItems": {
            "items": {
              "properties": {
                "decision": {
                  "const": "approved"
                }
              }
            }
          }
        }
      }
    }
  ],
  "$id": "https://abc-textbook.local/schemas/human-content-review-evidence.schema.json",
  "title": "ABC Textbook Self or Third-Party Content Review Evidence",
  "$comment": "Structural constraints are defined here; cross-field and collection invariants are enforced by the canonical Zod runtime validator.",
  "$defs": {
    "__schema0": {
      "type": "string",
      "const": "3.0.0"
    },
    "__schema1": {
      "type": "string",
      "pattern": "^human-content-review-[a-z0-9]+(?:-[a-z0-9]+)*$"
    },
    "__schema2": {
      "type": "string",
      "enum": [
        "merge",
        "release"
      ]
    },
    "__schema3": {
      "type": "string",
      "minLength": 1
    },
    "__schema4": {
      "anyOf": [
        {
          "type": "string",
          "pattern": "^\\d{4}\\.\\d{2}\\.\\d{2}$"
        },
        {
          "type": "null"
        }
      ]
    },
    "__schema5": {
      "type": "string",
      "pattern": "^[a-f0-9]{64}$"
    },
    "__schema6": {
      "type": "string",
      "pattern": "^(?!.*(?:^|\\/)(?:con|prn|aux|nul|com[1-9]|lpt[1-9])(?:\\.[A-Za-z0-9._-]+)?(?:\\/|$))(?:[A-Za-z0-9._-]*[A-Za-z0-9_-])(?:\\/[A-Za-z0-9._-]*[A-Za-z0-9_-])*$"
    },
    "__schema7": {
      "type": "object",
      "properties": {
        "requiredMode": {
          "$ref": "#/$defs/__schema8"
        },
        "riskReasons": {
          "$ref": "#/$defs/__schema9"
        },
        "highRiskSelfReviewReason": {
          "$ref": "#/$defs/__schema11"
        }
      },
      "required": [
        "requiredMode",
        "riskReasons"
      ],
      "additionalProperties": false
    },
    "__schema8": {
      "type": "string",
      "enum": [
        "self",
        "third_party"
      ]
    },
    "__schema9": {
      "type": "array",
      "items": {
        "$ref": "#/$defs/__schema10"
      },
      "uniqueItems": true
    },
    "__schema10": {
      "type": "string",
      "enum": [
        "official_source_conflict",
        "original_proof",
        "major_classification_change"
      ]
    },
    "__schema11": {
      "type": "string",
      "const": "solo_maintainer"
    },
    "__schema12": {
      "minItems": 1,
      "type": "array",
      "items": {
        "$ref": "#/$defs/__schema13"
      }
    },
    "__schema13": {
      "type": "object",
      "properties": {
        "checkId": {
          "type": "string",
          "pattern": "^check-[a-z0-9]+(?:-[a-z0-9]+)*$"
        },
        "command": {
          "$ref": "#/$defs/__schema3"
        },
        "subjectDigest": {
          "$ref": "#/$defs/__schema5"
        },
        "resultPath": {
          "$ref": "#/$defs/__schema6"
        },
        "resultDigest": {
          "$ref": "#/$defs/__schema5"
        },
        "exitCode": {
          "type": "integer",
          "minimum": -9007199254740991,
          "maximum": 9007199254740991
        },
        "passed": {
          "type": "boolean"
        },
        "completedAt": {
          "$ref": "#/$defs/__schema14"
        },
        "executedByReviewerId": {
          "$ref": "#/$defs/__schema15"
        }
      },
      "required": [
        "checkId",
        "command",
        "subjectDigest",
        "resultPath",
        "resultDigest",
        "exitCode",
        "passed",
        "completedAt",
        "executedByReviewerId"
      ],
      "additionalProperties": false
    },
    "__schema14": {
      "type": "string",
      "format": "date-time",
      "pattern": "^(?:(?:\\d\\d[2468][048]|\\d\\d[13579][26]|\\d\\d0[48]|[02468][048]00|[13579][26]00)-02-29|\\d{4}-(?:(?:0[13578]|1[02])-(?:0[1-9]|[12]\\d|3[01])|(?:0[469]|11)-(?:0[1-9]|[12]\\d|30)|(?:02)-(?:0[1-9]|1\\d|2[0-8])))T(?:(?:[01]\\d|2[0-3]):[0-5]\\d(?::[0-5]\\d(?:\\.\\d+)?)?(?:Z|([+-](?:[01]\\d|2[0-3]):[0-5]\\d)))$"
    },
    "__schema15": {
      "type": "string",
      "pattern": "^person-[a-z0-9]+(?:-[a-z0-9]+)*$"
    },
    "__schema16": {
      "type": "integer",
      "exclusiveMinimum": 0,
      "maximum": 9007199254740991
    },
    "__schema17": {
      "type": "integer",
      "minimum": 0,
      "maximum": 9007199254740991
    },
    "__schema18": {
      "minItems": 1,
      "type": "array",
      "items": {
        "$ref": "#/$defs/__schema19"
      }
    },
    "__schema19": {
      "type": "object",
      "properties": {
        "personId": {
          "$ref": "#/$defs/__schema15"
        },
        "authoredItemIds": {
          "minItems": 1,
          "type": "array",
          "items": {
            "$ref": "#/$defs/__schema3"
          },
          "uniqueItems": true
        }
      },
      "required": [
        "personId",
        "authoredItemIds"
      ],
      "additionalProperties": false
    },
    "__schema20": {
      "type": "object",
      "properties": {
        "personId": {
          "$ref": "#/$defs/__schema15"
        },
        "mode": {
          "$ref": "#/$defs/__schema8"
        }
      },
      "required": [
        "personId",
        "mode"
      ],
      "additionalProperties": false
    },
    "__schema21": {
      "type": "array",
      "items": {
        "type": "object",
        "properties": {
          "reviewItemId": {
            "$ref": "#/$defs/__schema22"
          },
          "kind": {
            "$ref": "#/$defs/__schema23"
          },
          "subjectPaths": {
            "$ref": "#/$defs/__schema24"
          },
          "authorIds": {
            "$ref": "#/$defs/__schema25"
          },
          "learningOutcomeIds": {
            "$ref": "#/$defs/__schema26"
          },
          "reviewerId": {
            "$ref": "#/$defs/__schema15"
          },
          "reviewBasis": {
            "$ref": "#/$defs/__schema3"
          },
          "decision": {
            "$ref": "#/$defs/__schema28"
          },
          "findings": {
            "$ref": "#/$defs/__schema29"
          },
          "reviewedAt": {
            "$ref": "#/$defs/__schema14"
          }
        },
        "required": [
          "reviewItemId",
          "kind",
          "subjectPaths",
          "authorIds",
          "learningOutcomeIds",
          "reviewerId",
          "reviewBasis",
          "decision",
          "findings",
          "reviewedAt"
        ],
        "additionalProperties": false
      }
    },
    "__schema22": {
      "type": "string",
      "pattern": "^human-review-item-[a-z0-9]+(?:-[a-z0-9]+)*$"
    },
    "__schema23": {
      "type": "string",
      "enum": [
        "outcome_coverage",
        "non_automatable_claim",
        "non_automatable_example"
      ]
    },
    "__schema24": {
      "minItems": 1,
      "type": "array",
      "items": {
        "$ref": "#/$defs/__schema6"
      },
      "uniqueItems": true
    },
    "__schema25": {
      "minItems": 1,
      "type": "array",
      "items": {
        "$ref": "#/$defs/__schema15"
      },
      "uniqueItems": true
    },
    "__schema26": {
      "type": "array",
      "items": {
        "$ref": "#/$defs/__schema27"
      },
      "uniqueItems": true
    },
    "__schema27": {
      "type": "string",
      "pattern": "^outcome-[a-z0-9]+(?:-[a-z0-9]+)*$"
    },
    "__schema28": {
      "type": "string",
      "enum": [
        "approved",
        "changes_requested"
      ]
    },
    "__schema29": {
      "type": "array",
      "items": {
        "type": "object",
        "properties": {
          "findingId": {
            "type": "string",
            "pattern": "^human-review-finding-[a-z0-9]+(?:-[a-z0-9]+)*$"
          },
          "severity": {
            "type": "string",
            "enum": [
              "blocking",
              "advisory"
            ]
          },
          "description": {
            "$ref": "#/$defs/__schema3"
          },
          "resolved": {
            "type": "boolean"
          },
          "evidenceRefs": {
            "minItems": 1,
            "type": "array",
            "items": {
              "$ref": "#/$defs/__schema3"
            },
            "uniqueItems": true
          }
        },
        "required": [
          "findingId",
          "severity",
          "description",
          "resolved",
          "evidenceRefs"
        ],
        "additionalProperties": false
      }
    },
    "__schema30": {
      "type": "integer",
      "minimum": 0,
      "maximum": 9007199254740991
    },
    "__schema31": {
      "type": "integer",
      "minimum": 0,
      "maximum": 9007199254740991
    },
    "__schema32": {
      "type": "integer",
      "minimum": 0,
      "maximum": 9007199254740991
    },
    "__schema33": {
      "type": "integer",
      "minimum": 0,
      "maximum": 9007199254740991
    },
    "__schema34": {
      "type": "integer",
      "minimum": 0,
      "maximum": 9007199254740991
    },
    "__schema35": {
      "type": "object",
      "properties": {
        "reviewerId": {
          "$ref": "#/$defs/__schema15"
        },
        "authorIds": {
          "$ref": "#/$defs/__schema36"
        },
        "decision": {
          "$ref": "#/$defs/__schema37"
        },
        "learningOutcomeIds": {
          "$ref": "#/$defs/__schema38"
        },
        "subjectPaths": {
          "$ref": "#/$defs/__schema39"
        },
        "rationale": {
          "$ref": "#/$defs/__schema3"
        },
        "noOutcomeImpactRationale": {
          "$ref": "#/$defs/__schema40"
        },
        "confirmedAt": {
          "$ref": "#/$defs/__schema14"
        }
      },
      "required": [
        "reviewerId",
        "authorIds",
        "decision",
        "learningOutcomeIds",
        "subjectPaths",
        "rationale",
        "noOutcomeImpactRationale",
        "confirmedAt"
      ],
      "additionalProperties": false
    },
    "__schema36": {
      "minItems": 1,
      "type": "array",
      "items": {
        "$ref": "#/$defs/__schema15"
      },
      "uniqueItems": true
    },
    "__schema37": {
      "type": "string",
      "enum": [
        "confirmed",
        "no_outcome_impact_confirmed"
      ]
    },
    "__schema38": {
      "type": "array",
      "items": {
        "$ref": "#/$defs/__schema27"
      },
      "uniqueItems": true
    },
    "__schema39": {
      "minItems": 1,
      "type": "array",
      "items": {
        "$ref": "#/$defs/__schema6"
      },
      "uniqueItems": true
    },
    "__schema40": {
      "anyOf": [
        {
          "$ref": "#/$defs/__schema3"
        },
        {
          "type": "null"
        }
      ]
    },
    "__schema41": {
      "type": "boolean"
    },
    "__schema42": {
      "type": "boolean"
    }
  }
}
