{
  "schemaVersion": "3.0.0",
  "id": "human-content-review-initial-v1-us3",
  "scopeType": "merge",
  "scopeId": "initial-v1-us3-learning-records",
  "releaseVersion": null,
  "subjectDigest": "23cd86661cff33cb51c53e661f5fd2993910bcdb2eeb197e25c8474a75e7b32c",
  "inventoryPath": "docs/work-manifests/initial/us3/manifest.json",
  "inventoryDigest": "4deae6354b0b0a47206822ef0d7f6d0d33752a8b7e945bde9b2784378cb8459e",
  "reviewPolicy": { "requiredMode": "self", "riskReasons": [] },
  "reviewMode": "self",
  "applicableChecks": [
    {
      "checkId": "check-us3-unit",
      "command": "/Users/fuma/Desktop/VSCode/abc-textbook/node_modules/.bin/vitest run --reporter=json",
      "subjectDigest": "23cd86661cff33cb51c53e661f5fd2993910bcdb2eeb197e25c8474a75e7b32c",
      "resultPath": "docs/verification/previews/initial-v1/learning-records/acceptance.json",
      "resultDigest": "e7ac0eacf4b83ea022d5cd7351541ae8d6ae151c705b5141b1c0789b1e623dd5",
      "exitCode": 0,
      "passed": true,
      "completedAt": "2026-07-29T13:40:16.687Z",
      "executedByReviewerId": "person-maintainer"
    },
    {
      "checkId": "check-us3-integration",
      "command": "/Users/fuma/Desktop/VSCode/abc-textbook/node_modules/.bin/vitest run --reporter=json",
      "subjectDigest": "23cd86661cff33cb51c53e661f5fd2993910bcdb2eeb197e25c8474a75e7b32c",
      "resultPath": "docs/verification/previews/initial-v1/learning-records/acceptance.json",
      "resultDigest": "e7ac0eacf4b83ea022d5cd7351541ae8d6ae151c705b5141b1c0789b1e623dd5",
      "exitCode": 0,
      "passed": true,
      "completedAt": "2026-07-29T13:40:16.687Z",
      "executedByReviewerId": "person-maintainer"
    },
    {
      "checkId": "check-us3-e2e",
      "command": "/Users/fuma/Desktop/VSCode/abc-textbook/node_modules/.bin/playwright test tests/e2e/learning-records.spec.ts --reporter=json",
      "subjectDigest": "23cd86661cff33cb51c53e661f5fd2993910bcdb2eeb197e25c8474a75e7b32c",
      "resultPath": "docs/verification/previews/initial-v1/learning-records/e2e.json",
      "resultDigest": "5818b3c4ce470d81add4b4d9776312bdc5b4a7900e4d3ed5293784139f274db8",
      "exitCode": 0,
      "passed": true,
      "completedAt": "2026-07-29T13:40:16.687Z",
      "executedByReviewerId": "person-maintainer"
    },
    {
      "checkId": "check-us3-static-quality",
      "command": "npm run check && npm run lint && npm run format:check && npm run build",
      "subjectDigest": "23cd86661cff33cb51c53e661f5fd2993910bcdb2eeb197e25c8474a75e7b32c",
      "resultPath": "docs/verification/previews/initial-v1/learning-records/acceptance.json",
      "resultDigest": "e7ac0eacf4b83ea022d5cd7351541ae8d6ae151c705b5141b1c0789b1e623dd5",
      "exitCode": 0,
      "passed": true,
      "completedAt": "2026-07-29T13:40:16.687Z",
      "executedByReviewerId": "person-maintainer"
    }
  ],
  "applicableCheckCount": 4,
  "passedApplicableCheckCount": 4,
  "reviewerExecutedCheckSetDigest": "ff88fddc1ddf011a4daf96d41a621007a96e47bb9eaa2d7389c9559168cff7eb",
  "authors": [
    {
      "personId": "person-maintainer",
      "authoredItemIds": ["us3.local-learning-records", "us3.backup-restore"]
    }
  ],
  "reviewer": { "personId": "person-maintainer", "mode": "self" },
  "reviewItems": [
    {
      "reviewItemId": "human-review-item-us3-local-records",
      "kind": "outcome_coverage",
      "subjectPaths": [
        "src/components/LearningRecordControl.tsx",
        "src/lib/learning-records/database.ts",
        "src/lib/learning-records/store.ts"
      ],
      "authorIds": ["person-maintainer"],
      "learningOutcomeIds": ["outcome-us3-local-learning-records"],
      "reviewerId": "person-maintainer",
      "reviewBasis": "Problem IDだけを永続keyとし、独立transaction、offset timestamp、reload、no-JavaScript、storage unavailableの挙動を3 browserで確認した。",
      "decision": "approved",
      "findings": [],
      "reviewedAt": "2026-07-29T13:40:16.687Z"
    },
    {
      "reviewItemId": "human-review-item-us3-backup-restore",
      "kind": "outcome_coverage",
      "subjectPaths": [
        "src/components/LearningRecordSettings.tsx",
        "src/lib/learning-records/import-preview.ts",
        "src/lib/learning-records/import-apply.ts"
      ],
      "authorIds": ["person-maintainer"],
      "learningOutcomeIds": ["outcome-us3-backup-restore"],
      "reviewerId": "person-maintainer",
      "reviewBasis": "privacy-minimal export、5分類preview、component-wise newer-wins、backup-wins、cancel、tie、unknown ID、invalid item、120件復元、失敗時0件反映を確認した。",
      "decision": "approved",
      "findings": [],
      "reviewedAt": "2026-07-29T13:40:16.687Z"
    }
  ],
  "inventoryItemCount": 2,
  "reviewedItemCount": 2,
  "approvedItemCount": 2,
  "changesRequestedItemCount": 0,
  "unreviewedItemCount": 0,
  "outcomeCoverageReview": {
    "reviewerId": "person-maintainer",
    "authorIds": ["person-maintainer"],
    "decision": "confirmed",
    "learningOutcomeIds": ["outcome-us3-backup-restore", "outcome-us3-local-learning-records"],
    "subjectPaths": [
      "docs/work-manifests/initial/us3/manifest.json",
      "docs/verification/previews/initial-v1/learning-records/acceptance.json",
      "docs/verification/previews/initial-v1/learning-records/e2e.json"
    ],
    "rationale": "US3の2 review unitは端末内記録操作とbackup/restoreの観察可能な成果を分離して網羅する。",
    "noOutcomeImpactRationale": null,
    "confirmedAt": "2026-07-29T13:40:16.687Z"
  },
  "outcomeCoverageConfirmed": true,
  "aggregatePassed": true,
  "generatedAt": "2026-07-29T13:40:16.687Z",
  "evidenceDigest": "847f9fd062f8c04ce9c53cf0d146cf27422f94399545bf3420344406801639ed"
}
